{
  "$schema": "https://json-schema.org/draft/2020-12/schema",
  "$id": "candice-layer-anchor-registry.schema.json",
  "title": "Candice Layer Anchor Registry (FIX-005)",
  "type": "object",
  "additionalProperties": false,
  "required": ["schemaVersion", "authority", "generatedAt", "measuredWith", "alphaThreshold", "reference", "driftPolicy", "states"],
  "properties": {
    "schemaVersion": { "type": "integer", "const": 1 },
    "authority": {
      "type": "string",
      "const": "operator-originals"
    },
    "generatedAt": {
      "type": "string",
      "pattern": "^\\d{4}-\\d{2}-\\d{2}T\\d{2}:\\d{2}:\\d{2}Z$"
    },
    "measuredWith": {
      "type": "object",
      "additionalProperties": false,
      "required": ["tool", "library"],
      "properties": {
        "tool": { "type": "string" },
        "library": { "type": "string" }
      }
    },
    "alphaThreshold": {
      "type": "integer",
      "minimum": 0,
      "maximum": 255
    },
    "reference": {
      "type": "object",
      "additionalProperties": false,
      "required": ["stateId", "sourceFile", "sha256", "frameWidth", "frameHeight"],
      "properties": {
        "stateId": { "type": "string" },
        "sourceFile": { "type": "string" },
        "sha256": { "type": "string", "pattern": "^[0-9a-f]{64}$" },
        "frameWidth": { "type": "integer", "minimum": 1 },
        "frameHeight": { "type": "integer", "minimum": 1 }
      }
    },
    "driftPolicy": {
      "type": "object",
      "additionalProperties": false,
      "required": ["maxDriftX", "maxDriftY"],
      "properties": {
        "maxDriftX": { "type": "number", "exclusiveMinimum": 0, "maximum": 1 },
        "maxDriftY": { "type": "number", "exclusiveMinimum": 0, "maximum": 1 }
      }
    },
    "states": {
      "type": "array",
      "minItems": 1,
      "uniqueItems": true,
      "items": {
        "type": "object",
        "additionalProperties": false,
        "required": [
          "stateId",
          "group",
          "phonemes",
          "sourceFile",
          "sha256",
          "frameWidth",
          "frameHeight",
          "anchorX",
          "anchorY",
          "requiredScaleX",
          "requiredScaleY",
          "maxDriftX",
          "maxDriftY"
        ],
        "properties": {
          "stateId": {
            "type": "string",
            "pattern": "^(mouth|eye)-[a-z-]+$"
          },
          "group": { "type": "string", "enum": ["mouth", "eye"] },
          "phonemes": {
            "type": "array",
            "items": { "type": "string" }
          },
          "sourceFile": { "type": "string" },
          "sha256": { "type": "string", "pattern": "^[0-9a-f]{64}$" },
          "frameWidth": { "type": "integer", "minimum": 1 },
          "frameHeight": { "type": "integer", "minimum": 1 },
          "anchorX": { "type": "number", "minimum": 0, "maximum": 1 },
          "anchorY": { "type": "number", "minimum": 0, "maximum": 1 },
          "requiredScaleX": { "type": "number", "exclusiveMinimum": 0 },
          "requiredScaleY": { "type": "number", "exclusiveMinimum": 0 },
          "maxDriftX": { "type": "number", "minimum": 0 },
          "maxDriftY": { "type": "number", "minimum": 0 }
        }
      }
    }
  }
}
